{
  "schema_version": 1,
  "batch_id": "ai-little-director-manga-v2",
  "defaults": {
    "width": 1920,
    "height": 1080,
    "fps": 30,
    "audio": {
      "provider": "edge",
      "voice": "zh-CN-XiaoxiaoNeural",
      "rate": "-4%",
      "pitch": "+0Hz"
    }
  },
  "cards": [
    {
      "id": "guangzhou-tower-cloud-team",
      "title": "广州塔云端小队",
      "author": {"name": "小雨", "class": "五年级二班"},
      "story_type": "我的研学之旅",
      "protagonists": ["小雨", "三位同学"],
      "location": "广州塔观景台",
      "beats": {
        "start": "小雨和三位同学来到广州塔观景台，准备完成寻找城市地标的研学任务。",
        "middle": "云雾遮住城市，大家根据地图、方向和灯光提示一起推理，寻找珠江和城市中轴线。",
        "end": "云雾散开，小队成功找出地标，并在温暖夕阳下拍下全队的云端合影。"
      },
      "visual_style": ["卡通动画", "冒险电影", "手工像素拼贴"],
      "palette": ["明亮彩色", "温暖夕阳", "天空蓝", "广州塔红"],
      "music_mood": ["快乐", "激动"],
      "director_intent": "像一次从云端俯瞰广州的快乐探险。",
      "manga": {
        "pacing": "cinematic",
        "dialogue_ratio": 0.67,
        "audience_grade": "primary-and-middle-school",
        "voice_cast": {
          "primary": "zh-CN-XiaoyiNeural",
          "secondary": "zh-CN-YunxiNeural",
          "tertiary": "zh-CN-YunyangNeural"
        },
        "must_show": ["珠江与广州城市中轴线", "地图、方向与灯光共同构成推理线索", "夕阳下的全队合影"],
        "avoid": ["把地标答案提前说出", "让云雾遮挡整场动作", "改变四名同学的服装与随身道具"],
        "factual_notes": ["广州塔观景台可俯瞰珠江与广州城市景观"],
        "scene_scripts": {
          "start": [
            {"speaker": "旁白", "role": "narrator", "kind": "narration", "text": "小雨和三位同学来到广州塔观景台。"},
            {"speaker": "小雨", "role": "primary", "kind": "dialogue", "text": "先找珠江，再确认城市中轴线！"},
            {"speaker": "红帽同学", "role": "tertiary", "kind": "dialogue", "text": "望远镜准备好了！"}
          ],
          "middle": [
            {"speaker": "旁白", "role": "narrator", "kind": "narration", "text": "云雾遮住城市，地图上的线索变得模糊。"},
            {"speaker": "蓝背心同学", "role": "secondary", "kind": "dialogue", "text": "珠江的走向能帮我们定位。"},
            {"speaker": "小雨", "role": "primary", "kind": "dialogue", "text": "结合方向和灯光，我们一起推理！"}
          ],
          "end": [
            {"speaker": "旁白", "role": "narrator", "kind": "narration", "text": "云雾散开，小队成功找出地标。"},
            {"speaker": "小雨", "role": "primary", "kind": "dialogue", "text": "任务完成，大家靠近一点！"},
            {"speaker": "红帽同学", "role": "tertiary", "kind": "dialogue", "text": "看镜头，三、二、一！"}
          ]
        }
      },
      "shot_hints": [
        {
          "title": "抵达云端",
          "primary": "一名穿黄色研学背心、背小书包的中国女孩小雨，兴奋地举起任务卡",
          "secondary": "两名穿蓝色研学背心的同学，手拿城市地图",
          "tertiary": "一名戴红色棒球帽的同学，举着望远镜",
          "rear": "远处珠江与广州城市天际线的像素剪影",
          "architecture": "广州塔观景台弧形玻璃与红色钢结构",
          "foreground": "贴近镜头的观景台栏杆和飘动的小队彩带",
          "direction": "right"
        },
        {
          "title": "云雾挑战",
          "primary": "小雨蹲下指着展开的城市地图，神情专注",
          "secondary": "两名同学并肩观察地图与远方灯光",
          "tertiary": "戴红帽的同学用望远镜穿过云雾寻找地标",
          "rear": "被白色云雾遮住的广州城市轮廓与若隐若现的珠江",
          "architecture": "观景台方向指示柱与发光地标标记",
          "foreground": "从画面两侧卷入的层叠云雾和地图纸角",
          "direction": "right"
        },
        {
          "title": "夕阳合影",
          "primary": "小雨站在队伍中央高举完成的任务卡，开心微笑",
          "secondary": "两名同学在小雨两侧做胜利手势",
          "tertiary": "戴红帽的同学举起相机准备合影",
          "rear": "夕阳下清晰可见的珠江与广州城市中轴线",
          "architecture": "广州塔观景台玻璃穹顶和金色反光",
          "foreground": "被夕阳照亮的彩带与轻盈纸屑",
          "direction": "left"
        }
      ]
    },
    {
      "id": "glowing-solar-system",
      "title": "会发光的太阳系",
      "author": {"name": "小曦", "class": "六年级一班"},
      "story_type": "科学大发现",
      "protagonists": ["小曦", "阿朗", "AI机器人小光"],
      "location": "科技博物馆",
      "beats": {
        "start": "小曦和阿朗在科技博物馆遇见机器人小光，发现中央太阳系模型正在一颗颗熄灭。",
        "middle": "三人沿着行星轨道寻找能量碎片，并按正确顺序修复轨道、重新连接能量。",
        "end": "太阳和八颗行星全部点亮，展厅化为星空，小光告诉他们好奇心就是点亮未知的光。"
      },
      "visual_style": ["卡通动画", "科技未来", "手工像素拼贴"],
      "palette": ["星空深蓝", "电光青", "太阳金", "明亮彩色"],
      "music_mood": ["神秘", "激动", "温暖"],
      "director_intent": "像一场会发光的博物馆宇宙探险。",
      "manga": {
        "pacing": "cinematic",
        "dialogue_ratio": 0.67,
        "audience_grade": "primary-and-middle-school",
        "voice_cast": {
          "primary": "zh-CN-XiaoyiNeural",
          "secondary": "zh-CN-YunxiNeural",
          "tertiary": "zh-CN-YunyangNeural"
        },
        "must_show": ["逐颗熄灭的太阳系模型", "按顺序修复轨道", "太阳和八颗行星全部点亮"],
        "avoid": ["改变八颗行星的数量", "让修复过程缺少顺序", "改变小曦、阿朗和小光的外观"],
        "factual_notes": ["太阳系包含八颗行星", "好奇心是故事主题而非科学结论"],
        "scene_scripts": {
          "start": [
            {"speaker": "旁白", "role": "narrator", "kind": "narration", "text": "中央太阳系模型正在一颗颗熄灭。"},
            {"speaker": "小曦", "role": "primary", "kind": "dialogue", "text": "阿朗，你看，行星正在失去亮光！"},
            {"speaker": "小光", "role": "tertiary", "kind": "dialogue", "text": "能量连接异常，请帮助我修复轨道。"}
          ],
          "middle": [
            {"speaker": "旁白", "role": "narrator", "kind": "narration", "text": "三人沿着行星轨道寻找能量碎片。"},
            {"speaker": "阿朗", "role": "secondary", "kind": "dialogue", "text": "先按顺序连接轨道，别接错位置！"},
            {"speaker": "小曦", "role": "primary", "kind": "dialogue", "text": "我去拿金色碎片，小光负责扫描！"}
          ],
          "end": [
            {"speaker": "旁白", "role": "narrator", "kind": "narration", "text": "太阳和八颗行星全部重新发光。"},
            {"speaker": "阿朗", "role": "secondary", "kind": "dialogue", "text": "最后一条轨道接通了！"},
            {"speaker": "小光", "role": "tertiary", "kind": "dialogue", "text": "好奇心，就是点亮未知的光。"}
          ]
        }
      },
      "shot_hints": [
        {
          "title": "熄灭的展厅",
          "primary": "穿橙色连帽外套的中国女孩小曦，抬头看着熄灭的太阳系模型",
          "secondary": "穿青色夹克的中国男孩阿朗，手持发光观察板",
          "tertiary": "圆头白色小型AI机器人小光，胸口蓝色灯光微弱闪烁",
          "rear": "黑暗科技博物馆与失去亮度的星空穹顶",
          "architecture": "中央悬浮太阳系轨道装置和环形展台",
          "foreground": "贴近镜头的暗色控制台边缘与少量熄灭指示灯",
          "direction": "right"
        },
        {
          "title": "追逐能量",
          "primary": "小曦向前奔跑并伸手抓住一块金色能量碎片",
          "secondary": "阿朗半跪在控制台前重新连接发光轨道",
          "tertiary": "机器人小光展开机械臂扫描蓝色能量碎片",
          "rear": "深蓝星空与多层发光行星轨道",
          "architecture": "故障中的控制环、能量核心和透明全息支架",
          "foreground": "高速掠过的像素能量碎片与电光轨迹",
          "direction": "right"
        },
        {
          "title": "点亮未知",
          "primary": "小曦站在中央高举最后一块能量碎片，脸上充满惊喜",
          "secondary": "阿朗在一旁完成最后一次轨道连接并抬头欢呼",
          "tertiary": "机器人小光胸口亮起温暖蓝光并举起双臂",
          "rear": "太阳和八颗行星全部发光的巨大星空",
          "architecture": "恢复运转的金色太阳核心和完整环形轨道",
          "foreground": "环绕主角飞散的彩色星尘与小型光点",
          "direction": "left"
        }
      ]
    },
    {
      "id": "navigator-time-letter",
      "title": "大航海家的时光信",
      "author": {"name": "子墨", "class": "七年级三班"},
      "story_type": "历史穿越",
      "protagonists": ["子墨", "郑和"],
      "location": "明代古港",
      "beats": {
        "start": "子墨在博物馆触碰航海图，穿过发光墨迹来到六百年前的明代港口，并见到郑和。",
        "middle": "海风吹散航线标记，子墨用现代地理知识帮助船队重新确认星位、季风和航向。",
        "end": "郑和把写给未来少年的信交给子墨，鼓励他永远保持探索世界的勇气。"
      },
      "visual_style": ["中国风", "冒险电影", "古籍像素拼贴"],
      "palette": ["宣纸米白", "朱砂红", "海洋蓝", "温暖夕阳"],
      "music_mood": ["冒险", "激动", "温暖"],
      "director_intent": "像一封跨越六百年的勇气来信。",
      "manga": {
        "pacing": "cinematic",
        "dialogue_ratio": 0.67,
        "audience_grade": "primary-and-middle-school",
        "voice_cast": {
          "primary": "zh-CN-YunxiNeural",
          "secondary": "zh-CN-YunyangNeural",
          "tertiary": "zh-CN-YunjianNeural"
        },
        "must_show": ["发光航海图与墨色时光门", "星位、季风和航向线索", "封有红色印章的时光信"],
        "avoid": ["添加未经任务卡支持的历史事件", "使用现代港口物件", "改变郑和与子墨的时代服装"],
        "factual_notes": ["故事发生在明代古港", "历史信息只采用任务卡已经给出的内容"],
        "scene_scripts": {
          "start": [
            {"speaker": "旁白", "role": "narrator", "kind": "narration", "text": "子墨穿过发光墨迹，来到明代古港。"},
            {"speaker": "子墨", "role": "primary", "kind": "dialogue", "text": "这里真是六百年前的港口？"},
            {"speaker": "郑和", "role": "secondary", "kind": "dialogue", "text": "少年，你从何处而来？"}
          ],
          "middle": [
            {"speaker": "旁白", "role": "narrator", "kind": "narration", "text": "海风吹散了航海图上的路线标记。"},
            {"speaker": "子墨", "role": "primary", "kind": "dialogue", "text": "可以用星位和季风重新确认方向。"},
            {"speaker": "郑和", "role": "secondary", "kind": "dialogue", "text": "好，我们一起把航线找回来。"}
          ],
          "end": [
            {"speaker": "旁白", "role": "narrator", "kind": "narration", "text": "郑和把写给未来少年的信交给子墨。"},
            {"speaker": "郑和", "role": "secondary", "kind": "dialogue", "text": "愿你永远保有探索世界的勇气。"},
            {"speaker": "子墨", "role": "primary", "kind": "dialogue", "text": "我会把这封信带回未来。"}
          ]
        }
      },
      "shot_hints": [
        {
          "title": "航海图开门",
          "primary": "穿现代深蓝校服的中国少年子墨，被发光航海图吸入墨色时光门",
          "secondary": "明代航海家郑和，穿红色官袍与黑色大帽，在港口回身看向少年",
          "tertiary": "一名明代水手抱着绳索惊讶地望向时光门",
          "rear": "明代港口远处的宝船桅杆与水墨海湾",
          "architecture": "木质码头、港口门楼与巨大的展开航海图",
          "foreground": "卷起的航海图纸边、墨滴和发光经纬线",
          "direction": "right"
        },
        {
          "title": "重建航线",
          "primary": "子墨跪在木桌前用手指连接星位与季风方向",
          "secondary": "郑和俯身查看航海图并指向右侧远洋",
          "tertiary": "明代水手在强风中扶住翻卷的航线标记",
          "rear": "暮色海面上的宝船舰队与北斗星",
          "architecture": "船头导航台、罗盘、木桌与悬挂风向旗",
          "foreground": "被风吹起的纸片、粗麻绳和浪花",
          "direction": "right"
        },
        {
          "title": "写给未来",
          "primary": "郑和郑重把封有红色印章的书信递向子墨",
          "secondary": "子墨双手接过书信，神情坚定而感动",
          "tertiary": "明代水手在远处扬起出航旗帜",
          "rear": "夕阳下起航的宝船与延伸向远方的海路",
          "architecture": "宝船船头、红色船舷与高大的明代帆",
          "foreground": "贴近镜头的信纸边缘、印章纹样与金色海浪",
          "direction": "left"
        }
      ]
    },
    {
      "id": "star-seed-forest",
      "title": "星种森林",
      "author": {"name": "乐乐", "class": "四年级四班"},
      "story_type": "奇幻世界",
      "protagonists": ["守林人叶芽", "小鹿"],
      "location": "失去星光的森林",